<?xml version="1.0" encoding="UTF-8"?>
<rnastructAlignmentML xmlns="http://hobit.sourceforge.net/xsds/20060515/rnastructAlignmentML"
    xmlns:xsi="http://www.w3.org/2001/XMLSchema-instance"
    xsi:schemaLocation="http://hobit.sourceforge.net/xsds/20060515/rnastructAlignmentML http://bibiserv.techfak.uni-bielefeld.de/xsd/net/sourceforge/hobit/20060515/rnastructAlignmentML.xsd">
    <rnastructurealignment>
        <sequence seqID="1">
            <description>human ferritin 5'</description>
            <alignedNucleicAcidSequence>CCAGACGUUCUUCGCCGAGAGUCGUCGGGGUUUCCUGCUUCAACAGUGCUUGGACGGAACCCGGCGCUCGUUCCCCACCCCGGCCGGCCGCCCAUAGCCAGCCCUCCGUCACCUCUUCACCGCACCCUCGGACUGCCCCAAGGCCCCCGCCGCCGCUCCAGCGCCGCGCAGCCACCGCCGCCGCCGCCGCCUCUCCUUAGUC-G--CCG------------------------------------C-C-</alignedNucleicAcidSequence>
            <structure>...(((............(((.(((((((..((((.(.(((((......))))))))))))))))))))...........((((((((.((.........((..((((....................))))..)).....(((...(((.((.((....)))).)))..)))...)).))))..))))..........)))-.--...------------------------------------.-.-</structure>
        </sequence>
        <sequence seqID="2">
            <description>mouse ferritin 5'</description>
            <alignedNucleicAcidSequence>CAGACGUUCUCGCCCAGAGUCGCCGCGGU--UUCCUGCUUCAACAGUGCUUGAACGG-AACC-CGGU-------------------GC-UC--------------------------------------------------GACCCCU-C-CGACCCCC-GCCG-GCCGCUUC---GA-GCCUGAGCCCUUUGCAACUUCGUCGUUCCGCCGCUCCAGCGUCGCCACCGCGCCUCGCCCCGCCGCCACC</alignedNucleicAcidSequence>
            <structure>..((((........(((((..((((.(((--(.((.(.(((((......))))))))-))))-))))-------------------((-((--------------------------------------------------((.....-(-((......-..))-).....))---))-)).......)))))......)))).....((.((....(((..((......))..)))...)).))....</structure>
        </sequence>
        <comment>Generated by 'appendFromDotBracketAlignment'!</comment>
    </rnastructurealignment>
</rnastructAlignmentML>